{
  "$schema": "https://json-schema.org/draft/2020-12/schema",
  "$id": "https://codeteam.dev/schemas/manifest.v0.1.json",
  "title": "CodeTeam Package Manifest",
  "description": "Manifest for a CodeTeam package (v0.1)",
  "type": "object",
  "required": [
    "schema_version",
    "package_version",
    "created_at",
    "intent",
    "workspace",
    "artifacts",
    "evidence",
    "policy"
  ],
  "properties": {
    "schema_version": {
      "type": "string",
      "const": "0.1",
      "description": "Schema version (must be 0.1)"
    },
    "package_version": {
      "type": "string",
      "pattern": "^[0-9]+\\.[0-9]+\\.[0-9]+(-[a-zA-Z0-9.]+)?$",
      "description": "Package version (semver)"
    },
    "created_at": {
      "type": "string",
      "format": "date-time",
      "description": "ISO 8601 timestamp of package creation"
    },
    "intent": {
      "type": "string",
      "enum": ["release", "handoff", "audit", "publish"],
      "description": "Package intent"
    },
    "workspace": {
      "type": "object",
      "required": ["name"],
      "properties": {
        "name": {
          "type": "string",
          "minLength": 1,
          "description": "Workspace/project name"
        },
        "repo_url": {
          "type": "string",
          "format": "uri",
          "description": "Repository URL"
        },
        "git_commit": {
          "type": "string",
          "pattern": "^[0-9a-f]{40}$",
          "description": "Git commit SHA (full 40 chars)"
        },
        "dirty": {
          "type": "boolean",
          "description": "Whether workspace had uncommitted changes"
        }
      },
      "additionalProperties": false
    },
    "artifacts": {
      "type": "array",
      "description": "Release artifacts",
      "items": {
        "$ref": "#/$defs/artifact"
      }
    },
    "evidence": {
      "type": "array",
      "description": "Evidence files",
      "items": {
        "$ref": "#/$defs/evidence_item"
      }
    },
    "policy": {
      "type": "object",
      "required": ["required_approvals", "approver_keys"],
      "properties": {
        "required_approvals": {
          "type": "integer",
          "minimum": 0,
          "description": "Number of approvals required"
        },
        "approver_keys": {
          "type": "array",
          "description": "Public keys authorized to approve",
          "items": {
            "$ref": "#/$defs/public_key"
          }
        }
      },
      "additionalProperties": false
    }
  },
  "additionalProperties": false,
  "$defs": {
    "sha256_digest": {
      "type": "string",
      "pattern": "^sha256:[0-9a-f]{64}$",
      "description": "SHA-256 digest with prefix"
    },
    "artifact": {
      "type": "object",
      "required": ["path", "sha256", "size_bytes"],
      "properties": {
        "path": {
          "type": "string",
          "pattern": "^[^/].*[^/]$|^[^/]$",
          "description": "Relative path (no leading/trailing slashes)"
        },
        "sha256": {
          "$ref": "#/$defs/sha256_digest"
        },
        "size_bytes": {
          "type": "integer",
          "minimum": 0,
          "description": "File size in bytes"
        },
        "media_type": {
          "type": "string",
          "description": "MIME type"
        }
      },
      "additionalProperties": false
    },
    "evidence_item": {
      "type": "object",
      "required": ["path", "sha256", "size_bytes", "kind"],
      "properties": {
        "path": {
          "type": "string",
          "pattern": "^[^/].*[^/]$|^[^/]$",
          "description": "Relative path"
        },
        "sha256": {
          "$ref": "#/$defs/sha256_digest"
        },
        "size_bytes": {
          "type": "integer",
          "minimum": 0
        },
        "kind": {
          "type": "string",
          "enum": ["tool-compass-run", "test-run", "build-log", "report", "other"],
          "description": "Evidence type"
        }
      },
      "additionalProperties": false
    },
    "public_key": {
      "type": "object",
      "required": ["id", "algorithm", "public_key"],
      "properties": {
        "id": {
          "type": "string",
          "pattern": "^[0-9a-f]{16}$",
          "description": "Key fingerprint (first 16 hex chars of sha256(pubkey))"
        },
        "algorithm": {
          "type": "string",
          "const": "ed25519",
          "description": "Signature algorithm"
        },
        "public_key": {
          "type": "string",
          "pattern": "^[A-Za-z0-9+/]+=*$",
          "description": "Base64-encoded public key"
        },
        "name": {
          "type": "string",
          "description": "Human-readable key name (optional)"
        }
      },
      "additionalProperties": false
    }
  }
}
